<?xml version="1.0" encoding="UTF-8"?>
<xs:schema xmlns:xs="http://www.w3.org/2001/XMLSchema">

    <xs:element name="ripa">
        <xs:complexType>
            <xs:sequence>
                <xs:element name="producto" maxOccurs="unbounded">
                    <xs:complexType>
                        <xs:sequence>
                            <xs:element name="nombre" type="xs:string"/>
                            <xs:element name="categoria" type="xs:string" minOccurs="0"/>
                            <xs:element name="unidad_medida" type="xs:string"/>

                            <xs:element name="registros">
                                <xs:complexType>
                                    <xs:sequence>
                                        <xs:element name="registro" maxOccurs="unbounded">
                                            <xs:complexType>
                                                <xs:sequence>
                                                    <xs:element name="fecha" type="xs:date"/>
                                                    <xs:element name="precio">
                                                        <xs:simpleType>
                                                            <xs:restriction base="xs:decimal">
                                                                <xs:minInclusive value="0.01"/>
                                                            </xs:restriction>
                                                        </xs:simpleType>
                                                    </xs:element>
                                                    <xs:element name="supermercado" type="xs:string"/>
                                                </xs:sequence>
                                            </xs:complexType>
                                        </xs:element>
                                    </xs:sequence>
                                </xs:complexType>
                            </xs:element>

                        </xs:sequence>

                        <xs:attribute name="id" type="xs:integer" use="required"/>
                    </xs:complexType>
                </xs:element>
            </xs:sequence>
        </xs:complexType>
    </xs:element>

</xs:schema>
